<?xml version="1.0" encoding="iso-8859-1"?>
<!DOCTYPE LabyrinthGame SYSTEM "Game.dtd">
<LabyrinthGame>
  <Levels>
    <Level>
      <Name> leichtes Labyrinth </Name>
      <File> config/games/level1.xml </File>
    </Level>
    <Level>
      <Name> schweres Labyrinth </Name>
      <File> config/games/level2.xml </File>
    </Level>
    <Level>
      <Name> Labyrinth mit Loops </Name>
      <File> config/games/loops.xml </File>
    </Level>
    <Level>
      <Name> Labyrinth mit Plätzen </Name>
      <File> config/games/level5.xml </File>
    </Level>
  </Levels>
</LabyrinthGame>